{
  "schema_version": "echonet.event.v0.1",
  "event_id": "evt_waitlist_0001",
  "timestamp": "2026-07-14T15:15:00Z",
  "source": {
    "system": "echopathxr_website",
    "adapter": "website_conversion_v0.1",
    "source_id": "memory-layer-waitlist",
    "session_id": "session_hash_waitlist_0001"
  },
  "domain": "EchoPathXRWebsite",
  "event_type": "conversion.intent",
  "seal_mode": "local",
  "eta_proxy": 0.0,
  "coherence": {
    "r_value": 0.0,
    "spectral_entropy": 0.0,
    "concurrence_proxy": 0.0,
    "anomaly_score": 0.0,
    "anomaly_flag": false,
    "confidence": 1.0
  },
  "privacy": {
    "classification": "restricted_summary",
    "raw_payload_retention": "none",
    "identity_mode": "pseudonymous"
  },
  "payload": {
    "intent_type": "waitlist",
    "source_page": "/echopath-memory-layer/",
    "source_demo": "room-remembers",
    "product_interest": "memory-layer-starter-edition",
    "campaign_id": "organic-site",
    "consent_to_contact": true
  },
  "references": ["docs/WEBSITE_DEMO_TELEMETRY.md"]
}
