{
  "schema_version": "echonet.event.v0.1",
  "event_id": "evt_cluster_seed42_0001",
  "timestamp": "2026-01-11T04:35:00Z",
  "source": {
    "system": "aethernode",
    "adapter": "aethernode_cluster_v0.1",
    "source_id": "seed42_cluster_alpha",
    "node_id_hash": "cluster_alpha_hash"
  },
  "domain": "AetherNode",
  "event_type": "cluster.coherence",
  "seal_mode": "local",
  "eta_proxy": 0.41,
  "coherence": {
    "r_value": 0.33,
    "spectral_entropy": 2.57,
    "concurrence_proxy": 0.41,
    "anomaly_score": 0.12,
    "anomaly_flag": false,
    "confidence": 0.86
  },
  "privacy": {
    "classification": "internal",
    "raw_payload_retention": "short_window",
    "identity_mode": "node_hash"
  },
  "payload": {
    "cluster_event_type": "coherence.window",
    "cluster_id": "cluster_alpha",
    "node_count": 5,
    "window_start": "2026-01-11T04:35:00Z",
    "window_end": "2026-01-11T04:35:05Z",
    "sensor_profile": ["qrng", "emf", "magnetic", "temp", "vibration", "acoustic"],
    "baseline_ref": "seed42",
    "simulation_version": "EchoNet_Phase1_v1.0"
  },
  "references": ["docs/AETHERNODE_TELEMETRY.md", "docs/CLUSTER_AND_SIMULATION_BASELINE.md"]
}
