{
  "schema_version": "echonet.event.v0.1",
  "event_id": "evt_navigator_decision_0001",
  "timestamp": "2026-01-11T04:44:00Z",
  "source": {
    "system": "navigator",
    "adapter": "navigator_decision_v0.1",
    "source_id": "navigator_operator_panel",
    "session_id": "navigator_session_hash"
  },
  "domain": "Navigator",
  "event_type": "navigator.decision",
  "seal_mode": "local",
  "eta_proxy": 0.52,
  "coherence": {
    "r_value": 0.39,
    "spectral_entropy": 2.3,
    "concurrence_proxy": 0.48,
    "anomaly_score": 0.1,
    "anomaly_flag": false,
    "confidence": 0.87
  },
  "privacy": {
    "classification": "internal",
    "raw_payload_retention": "none",
    "identity_mode": "pseudonymous"
  },
  "payload": {
    "decision_event_type": "route.recommendation_selected",
    "recommendation_id": "rec_hash_0001",
    "operator_action": "accept_recommendation",
    "route_card_id": "route_card_echopath_0001",
    "decision_confidence": 0.82,
    "reason_codes": ["low_churn", "high_eta_proxy", "safe_route_memory"]
  },
  "references": ["docs/NAVIGATOR_TELEMETRY.md"]
}
